{
  "schema_version": "phase1-preregistration-v1",
  "record_kind": "ROUTER_LAB_PHASE1_STAGE_A_PREREGISTRATION",
  "status": "READY_FOR_SOL_REVIEW",
  "execution_authorized": false,
  "repository": "pzy19-prog/pzy-router-lab",
  "branch": "phase1/preregistration",
  "base_commit": "47a00d9135fd8c262e82d2a0a16f2ea25ca18372",
  "issue": "https://github.com/pzy19-prog/pzy-router-lab/issues/3",
  "as_of": "2026-09-24",
  "scope": {
    "stage": "A",
    "purpose": "Freeze the proposed experiment protocol for independent review; no model evaluation is authorized.",
    "prohibited": [
      "Laya or RouteLLM inference",
      "large model weight downloads",
      "paid API calls",
      "Jev rerun",
      "fine-tuning",
      "formal held-out result creation",
      "performance conclusions",
      "changes to Nexus, Relay, Forge, PCT, or Playbook",
      "push or merge"
    ],
    "dev_data": "All Phase 0 cases and prompts remain public dev/protocol-validation data only."
  },
  "research_question": {
    "primary_research_question": "On a newly generated, independently sealed test set, does a frozen local-first semantic routing configuration improve task outcome success over the deterministic Rules baseline while preserving policy invariants and staying within an independently approved resource and cost budget? If no candidate meets feasibility or evidentiary requirements, report insufficient evidence or candidate not feasible rather than infer an advantage.",
    "tracks": {
      "controlled_routing_comparison": {
        "purpose": "Compare decision behavior under the same router-visible information and availability conditions.",
        "allowed_router_input": [
          "case_id/task_id",
          "complexity",
          "sensitivity",
          "risk",
          "available_targets",
          "allow_cloud",
          "frozen scenario/availability state only where every included method consumes the same value"
        ],
        "task_prompt_visible_to_router": false,
        "comparison_objects": [
          "Rules baseline",
          "only candidate adapters that accept an identical canonical metadata payload without extra prompt-derived fields"
        ],
        "eligibility": "No candidate adapter is presumed eligible. If the shared serialized input contract cannot be demonstrated, it is excluded from this track.",
        "allowed_conclusions": [
          "router decision distribution and correctness against verified routing gold",
          "policy invariant behavior",
          "router-only latency under the pinned environment"
        ],
        "prohibited_conclusions": [
          "task answer quality or task outcome success from decision labels",
          "equal-information algorithm comparison where actual inputs differ",
          "general model quality"
        ]
      },
      "end_to_end_system_comparison": {
        "purpose": "Compare whole frozen router-adapter-executor configurations on the same task fixtures and outcome rubric.",
        "allowed_input": "Each configured router and adapter may consume only its documented, pinned supported inputs; task text can be provided to components that actually support it. Rules receives metadata only; its executor receives the task prompt after routing.",
        "comparison_objects": [
          "Rules + pinned executor/fallback behavior",
          "each independently reviewed router + adapter + executor configuration that passes license, safety, and feasibility gates"
        ],
        "required_reporting": "List actual router and executor inputs, mappings, adapter identity, and model pair for every configuration.",
        "allowed_conclusions": [
          "system-level blinded task outcomes",
          "system-level escalation/fallback behavior",
          "router and end-to-end latency",
          "measured local resource use and applicable token/API cost"
        ],
        "prohibited_conclusions": [
          "router-only causal advantage when executor/configuration/input differences remain",
          "universal model quality or production value beyond the tested configurations"
        ]
      },
      "separation": "Tracks are analyzed and reported separately; no metric is transferred between tracks."
    }
  },
  "data_plan": {
    "phase0_disposition": "dev_only_not_heldout",
    "formal_heldout_created": false,
    "heldout_creation_status": "PROTOCOL_ONLY_PENDING_DATA_OWNER_AND_SOL_REVIEW",
    "generation_method": {
      "source_frame": "PRE_REGISTRATION_REQUIRED: data owner must identify target task population, strata, inclusion/exclusion criteria, and source/authoring method before case production.",
      "procedure": [
        "Freeze population, task-family/language/risk strata, sampling or authoring quotas, rubrics, and generator version before generating cases.",
        "A data custodian who does not implement or tune candidate routers creates or samples new cases after adapters and configurations are frozen.",
        "Do not copy, paraphrase, relabel, or select from Phase 0 fixtures; do not use model outputs to author or filter cases.",
        "Use only authorized, de-identified or purpose-authored content; record provenance and rights for each case.",
        "Complete overlap/leakage review before sealing."
      ],
      "sample_count": "PRE_REGISTRATION_REQUIRED / NOT YET JUSTIFIED"
    },
    "split_and_access": {
      "dev": "Existing 12 public Phase 0 cases/prompts; available for protocol validation and adapter development only.",
      "independent_test": "New cases only, disjoint IDs and content; held by an independent custodian in a private access-controlled location, never committed to this public repository before evaluation.",
      "train": "None authorized; no training, fine-tuning, threshold tuning, or calibration in this experiment.",
      "separation": "Router implementers and configuration selectors do not receive held-out prompts, labels, or per-case digests before final configuration lock. The custodian logs access. Independent adjudicators do not see router identity/output when labeling gold."
    },
    "leakage_prevention": [
      "Keep held-out contents and unsalted content hashes outside the public repository and away from adapter/configuration authors until the run is locked.",
      "Check exact and normalized-text overlap against Phase 0 and any declared source benchmark; use semantic/manual review for likely paraphrase overlap.",
      "Record known source benchmark contamination and model-pretraining uncertainty; do not claim pretraining leakage is fully detectable.",
      "No held-out inspection, prompt editing, example selection, or threshold adjustment after any candidate output is seen.",
      "Any post-unseal change to case, rubric, adapter, prompt template, threshold, or model configuration invalidates that test version for confirmatory use and requires a newly generated version plus review."
    ],
    "identity_and_seal": {
      "case_id": "Random opaque UUID assigned once by custodian; stable across tracks, not content-derived, never reused across splits.",
      "prompt_digest": "SHA-256 of the exact UTF-8 task_input bytes as stored in the sealed record; normalization/line-ending policy is fixed before generation and recorded.",
      "input_digest": "SHA-256 of canonical UTF-8 JSON for the exact router payload (sorted keys, compact separators, ensure_ascii=false); keep separate digests for each track/configuration payload. Do not pass the task prompt to Controlled routers.",
      "sealed_manifest": "Store dataset version, generation procedure/version, split, case IDs, file-level and per-case digest, rubric version, access-control record, and creation timestamp in a signed/append-only private manifest. Publish only a commitment that does not expose recoverable prompt hashes before unseal.",
      "unseal": "Custodian releases cases to the frozen runner only after Sol review and all hard gates are satisfied; record exact sealed-manifest digest and unseal event in the run receipt."
    },
    "gold_and_blinding": {
      "routing_gold": "At least two independent adjudicators review the frozen routing policy and permitted metadata without router outputs or execution outcomes. They label independently; a third adjudicator resolves disagreement. Store rubric/version, individual labels, adjudicated label, rationale, and disagreement.",
      "task_outcome_gold": "For executable cases, use a frozen itemized rubric and fixed executor. Reviewers see anonymized outputs, not router/system identity, route decision, or attempt history where that history is not required to score the rubric. Two reviewers score independently; a third resolves disagreement.",
      "unknown": "If policy or output evidence is insufficient or adjudicators cannot resolve a label, preserve UNKNOWN with reason. Never force a label or silently remove the case. Report unknown/unscorable counts and rates."
    },
    "unknown_handling": {
      "analysis": "Intention-to-treat by assigned case. Technical failure, abstention, escalation, or fallback remains an observed result and is not dropped.",
      "decision_accuracy": "UNKNOWN gold is excluded from the scorable accuracy numerator and denominator, with eligible, scored, and UNKNOWN counts/rates reported separately.",
      "task_success": "A valid judged output that fails any required rubric item is failure. Missing/corrupt output is task failure if attributable to the system; otherwise outcome is UNKNOWN with reason and retained in the flow accounting.",
      "policy_unknown": "Unknown risk or sensitivity must follow the frozen fail-closed policy; a missing policy input is reported and is not recoded as safe."
    }
  },
  "sample_size_and_statistics": {
    "design": "Paired case-level comparison on the same sealed cases; report raw counts and paired differences. Stratify descriptive results by predeclared task/language/risk strata.",